id;title;link;price;description;condition;ean;brand;mpn;image_link;product_type;availability;quantity;shipping;TVA;feature;online_only;manufacturer;expiration_date;shipping_weight;genre;featured_product;color;size;year;author;edition;google_product_category
575-616; bain moussant stimulant   [melvita] volume - 200 ml;http://www.lilibio.com/bain-moussant-bio/575-bain-stimulant.html;9.5;Bain relaxant aux huiles essentielles de géranium, pamplemousse et d'eucalyptus. Laissez-vous emporter dans la détente du corps et de l'esprit.;new;3284410015251;Melvita;;http://www.lilibio.com/img/p/575-710-large.jpg;Hygiène>Bain moussant;in stock;5;:::5.9;;;y;Melvita;;0;;n;;;;;;
576-617; bain moussant base neutre   [melvita] volume - 500 ml;http://www.lilibio.com/bain-moussant-bio/576-bain-moussant-base-neutre.html;7.9;Composé autour d’eau florale de tilleul, ce bain moussant neutre est parfait pour les peaux délicates et allergiques. Idéal comme base pour créer un bain aux huiles essentielles. Demandez conseil pour choisir vos huiles.;new;3284410015275;Melvita;;http://www.lilibio.com/img/p/576-711-large.jpg;Hygiène>Bain moussant;in stock;4;:::5.9;;;y;Melvita;;0;;n;;;;;;
838; peigne applicateur pour coloration   [logona];http://www.lilibio.com/accessoire-cheveux/838-peigne-applicateur-pour-colorations.html;1.9;Pour une couleur plus facile à poser, grâce au peigne biseauté logona.;new;;Logona;;http://www.lilibio.com/img/p/838-1091-large.jpg;Capillaire>Accessoire cheveux;in stock;7;:::5.9;;;y;Logona;;0;;n;;;;;;Santé et beauté
114-165; argile blanche surfine   [cattier] poids - 200g;http://www.lilibio.com/argile-en-poudre-masque/114-argile-blanche-surfine.html;4.9;L'Argile Blanche Surfine est la plus douce des argiles, elle peut s'utiliser pour ses bienfaits sur la peau mais aussi sur l'organisme. Idéale en masque purifiant sur l'ensemble du visage.;new;3283950011044;Cattier;;http://www.lilibio.com/img/p/114-198-large.jpg;Argilothérapie;in stock;6;:::5.9;;;y;Cattier;;0;;n;;;;;;
115-166; argile verte surfine   [cattier] poids - 1kg;http://www.lilibio.com/argile-en-poudre-masque/115-argile-verte-surfine.html;5.9;Grâce à ses multiples propriétés,  l'Argile Verte Surfine peut s'utiliser pour ses  bienfaits sur la peau  mais aussi sur l'organisme. Parfaite pour action purifiante sur la zone T du visage.;new;3283950911757;Cattier;;http://www.lilibio.com/img/p/115-197-large.jpg;Argilothérapie;in stock;5;:::5.9;;;y;Cattier;;0;;n;;;;;;
143-196; stick lèvre au karité et huile de sésame   [oléanat] poids - 4.5g;http://www.lilibio.com/soin-des-levres/143-stick-levre-au-karite-et-huile-de-sesame.html;4.9;Nourrit, hydrate et surtout protège grâce au beurre de karité et à l'huile de sésame. Goût framboise.;new;3760087900880;Oléanat;;http://www.lilibio.com/img/p/143-234-large.jpg;Visage>Soin des lèvres;in stock;17;:::5.9;;;y;Oléanat;;0;;n;;;;;;
144-197; stick lèvre au lait d'ânesse   [oléanat] poids - 4.5g;http://www.lilibio.com/soin-des-levres/144-stick-levre-au-lait-d-anesse.html;9.9;Toute la douceur du lait d'ânesse dans un soin complet pour vos lèvres. prenez soin de vous cet hiver.;new;3760087902037;Oléanat;;http://www.lilibio.com/img/p/144-235-large.jpg;Visage>Soin des lèvres;in stock;11;:::5.9;;;y;Oléanat;;0;;n;;;;;;
239-294; baume lèvres généreux dermastress  [florame] volume - 15 ml;http://www.lilibio.com/soin-des-levres/239-baume-levres-genereux.html;9.4;Une nutrition intense et un fini glamour. Le complexe derma-stress protège nourrit et combat contre les agressions exterieures et les signes de l'âge.;new;3516170016941;Florame;;http://www.lilibio.com/img/p/239-342-large.jpg;Visage>Soin des lèvres;in stock;4;:::5.9;;;y;Florame;;0;;n;;;;;;
246-301; baume lèvres nutrition intense   [florame] poids - 4g;http://www.lilibio.com/soin-des-levres/246-baume-levre-nutrition-intense.html;5.7;Un soin protecteur des lèvres fines et fragiles. La gamme nutrition intense régénère et protège avec son complexe de beurre de karité, huiles essentielles de bois de rose, orange amère et ylang ylang.;new;3516170018549;Florame;;http://www.lilibio.com/img/p/246-349-large.jpg;Visage>Soin des lèvres;in stock;10;:::5.9;;;y;Florame;;0;;n;;;;;;
446; stick à lèvre réparateur à la cameline  [plante system];http://www.lilibio.com/soin-des-levres/446-soin-levre-reparateur.html;4.9;Vos lèvres sont apaisées et réparées. Senteur fruitée.;new;3401395201497;Plante system;;http://www.lilibio.com/img/p/446-566-large.jpg;Visage>Soin des lèvres;in stock;6;:::5.9;;;y;Plante system;;0;;n;;;;;;Santé et beauté
447; stick à lèvre nourrissant à l'argan  [plante system];http://www.lilibio.com/soin-des-levres/447-stick-a-levre-nourrissant-.html;4.9;Vos lèvres sont douces, souples et hydratées. Senteur vanille.;new;3401395201039;Plante system;;http://www.lilibio.com/img/p/447-567-large.jpg;Visage>Soin des lèvres;in stock;7;:::5.9;;;y;Plante system;;0;;n;;;;;;Santé et beauté
637-679; baume à lèvre au chocolat  [marilou bio] volume - 5 ml;http://www.lilibio.com/soin-des-levres/637-baume-a-levre-au-chocolat.html;3.9;De la douceur pour vos lèvres. Riche en beurre de karité, en huile de tournesol et en cire, il protège et nourrit durablement vos lèvres.;new;3760143830595;Marilou bio;;http://www.lilibio.com/img/p/637-779-large.jpg;Visage>Soin des lèvres;in stock;7;:::5.9;;;y;Marilou bio;;0;;n;;;;;;
639-681; baume à lèvre à la vanille   [marilou bio] volume - 5 ml;http://www.lilibio.com/soin-des-levres/639-baume-a-levre-vanille.html;3.9;Apaise et permet une bonne hydratation des lèvres. Riche en beurre de karité, en huile de tournesol et en cire, il protège et nourrit durablement vos lèvres.;new;3760143830571;Marilou bio;;http://www.lilibio.com/img/p/639-1172-large.jpg;Visage>Soin des lèvres;in stock;8;:::5.9;;;y;Marilou bio;;0;;n;;;;;;
640-682; baume à lèvre à la pêche  [marilou bio] volume - 5 ml;http://www.lilibio.com/soin-des-levres/640-baume-a-levre-peche.html;3.9;Apaise et permet une bonne hydratation des lèvres. Riche en beurre de karité, en huile de tournesol et en cire, il protège et nourrit durablement vos lèvres.;new;3760143830564;Marilou bio;;http://www.lilibio.com/img/p/640-782-large.jpg;Visage>Soin des lèvres;in stock;7;:::5.9;;;y;Marilou bio;;0;;n;;;;;;
682-710; stick lèvre protecteur   [melvita] volume - 4,5ml;http://www.lilibio.com/soin-des-levres/682-stick-levre-.html;5.9; Soin protecteur des lèvres nourrissant au beurre de karité au parfum vanillé.;new;3284410009823;Melvita;;http://www.lilibio.com/img/p/682-828-large.jpg;Visage>Soin des lèvres;in stock;11;:::5.9;;;y;Melvita;;0;;n;;;;;;
806-835; baume lèvre kiss of ice [néobio] poids - 4.5g;http://www.lilibio.com/soin-des-levres/806-baume-levre-kiss-of-ice.html;4.5;Le  baume lèvre Kiss of Ice Néobio hydrate et apaise les lèvres  fragilisées par les agressions extérieures. Une composition riche en  huile et cires pour un maximum de confort.;new;4017645110021;Néobio;;http://www.lilibio.com/img/p/806-967-large.jpg;Visage>Soin des lèvres;in stock;6;:::5.9;;;y;Néobio;;0;;n;;;;;;
807-836; baume lèvre kiss of wild berries [néobio] poids - 4.5g;http://www.lilibio.com/soin-des-levres/807-baume-levre-kiss-of-wild-berries.html;4.5;Le  baume lèvre Kiss of Wild berries Néobio hydrate et apaise les lèvres  fragilisées par les agressions extérieures. Une composition riche en  huile de framboise et cires pour un maximum de confort.;new;4017645110038;Néobio;;http://www.lilibio.com/img/p/807-966-large.jpg;Visage>Soin des lèvres;in stock;1;:::5.9;;;y;Néobio;;0;;n;;;;;;
809-839; baume lévre kiss of mango [néobio] poids - 4.5g;http://www.lilibio.com/soin-des-levres/809-baume-levre-kiss-of-mango.html;4.5;Le  baume lèvre Kiss of Mango Néobio hydrate et apaise les lèvres  fragilisées par les agressions extérieures. Une composition riche, huile, cires et beurre de mangue pour un maximum de confort.;new;4017645110007;Néobio;;http://www.lilibio.com/img/p/809-964-large.jpg;Visage>Soin des lèvres;in stock;9;:::5.9;;;y;Néobio;;0;;n;;;;;;
962;stick lèvre hydratant à l'huile d'immortelle [plante system];http://www.lilibio.com/soin-des-levres/962-stick-levre-hydratant-al-huile-d-immortelle-plante-system-.html;4.9;Pour des lèvres naturellement douce et hydratées. Senteur fleur d'oranger.;new;3401397506071;Plante system;;http://www.lilibio.com/img/p/962-1236-large.jpg;Visage>Soin des lèvres;in stock;7;:::5.9;;;y;Plante system;;0;;n;;;;;;Santé et beauté
26-60; baume de diane fluide jolis seins  [les douces angevines] volume - 50;http://www.lilibio.com/soin-du-buste/26-baume-de-diane.html;37.9;Fluide huileux jolis seins, galbe, tonifie et embellit votre décolleté. Une mélange subtil d'huiles végétales qui favorisent l'élasticité des tissus et un soupson d'huiles essentielles pour dynamiser et cicatriser les traces résiduelles. Compatible avec la grossesse.;new;3555960000197;Les douces angevines;;http://www.lilibio.com/img/p/26-67-large.jpg;Corps>Buste;in stock;2;:::5.9;;;y;Les douces angevines;;0;;n;;;;;;
179-232; gelée buste repulpante anti-âge lift'argan [natessance] volume - 10;http://www.lilibio.com/soin-du-buste/179-gelee-buste-repulpante-anti-age.html;24.9;La gelée buste repulpante Lift'Argan est un soin tonique du décolleté. Il apporte un effet regalbant à votre poitrine.;new;3517360002614;Natessance;;http://www.lilibio.com/img/p/179-278-large.jpg;Corps>Buste;in stock;5;:::5.9;;;y;Natessance;;0;;n;;;;;;
183-234; crème teintée lumière d'orient lift'argan [natessance] volume - 30;http://www.lilibio.com/soin-teinte/183-creme-teintee-lumiere-d-orient.html;13.9;La  crème teintée anti-rides Lift 'Argan Désir d'Orient, illumine votre teint et nourrit votre peau. Effet naturel assuré! Existe en 2 teintes.;new;3517360047103;Natessance;;http://www.lilibio.com/img/p/183-283-large.jpg;Visage>Soin teinté;in stock;6;:::5.9;;;y;Natessance;;0;;n;;;;;;
183-235; crème teintée lumière d'orient lift'argan [natessance] volume - 30;http://www.lilibio.com/soin-teinte/183-creme-teintee-lumiere-d-orient.html;13.9;La  crème teintée anti-rides Lift 'Argan Désir d'Orient, illumine votre teint et nourrit votre peau. Effet naturel assuré! Existe en 2 teintes.;new;3517360037104;Natessance;;http://www.lilibio.com/img/p/183-282-large.jpg;Visage>Soin teinté;in stock;2;:::5.9;;;y;Natessance;;0;;n;;;;;;
185-238; fluide embellisseur lumière d'orient lift'argan [natessance] volume ;http://www.lilibio.com/soin-teinte/185-fluide-embellisseur-lumiere-d-orient-lift-argan.html;21.9;Le fluide embellisseur Lift'Argan est un soin réflecteur de lumière, il unifie le teint et rehausse le teint de manière naturelle, grâce aux nacres et aux réflecteurs de lumière...;new;3517360000894;Natessance;;http://www.lilibio.com/img/p/185-285-large.jpg;Visage>Soin teinté;in stock;3;:::5.9;;;y;Natessance;;0;;n;;;;;;
444-487; fluide hydratant bonne mine à l'hibiscus [plante system] volume - 30;http://www.lilibio.com/soin-teinte/444-fluide-hydratant-bonne-mine-a-l-hibiscus.html;16.9;Ce soin hydratant bonne mine agit aussi sur les rides. Sa texture fondante permet une pause rapide et sans traces. Un effet naturel immédiat! Primé aux victoires de la beauté 2009-2010.;new;3578830147969;Plante system;;http://www.lilibio.com/img/p/444-564-large.jpg;Visage>Soin teinté;in stock;3;:::5.9;;;y;Plante system;;0;;n;;;;;;
679-705; crème bonne mine, ton abricot   [melvita] volume - 40ml;http://www.lilibio.com/soin-teinte/679-creme-bonne-mine.html;15.2;Soin illuminateur, ton abricot. Matifiant mais non désséchant, cette crème vous séduit par sa texture fondante et son odeur fruitée. Un vrai délice d'été.;new;3284410013622;Melvita;;http://www.lilibio.com/img/p/679-825-large.jpg;Visage>Soin teinté;in stock;6;:::5.9;;;y;Melvita;;0;;n;;;;;;
680-706; crème teintée hâle doré   [melvita] volume - 40ml;http://www.lilibio.com/soin-teinte/680-creme-teintee-dore.html;15.2;Crème teintée effet hâle naturel. Grâce à son association d'huile de jojoba et de cameline, ce soin matifiant nourrit la peau sans la déssécher.;new;3284410013653;Melvita;;http://www.lilibio.com/img/p/680-826-large.jpg;Visage>Soin teinté;in stock;3;:::5.9;;;y;Melvita;;0;;n;;;;;;
218-274; huile de massage relaxante pour homme [florame] volume - 150 ml;http://www.lilibio.com/massage/218-huile-de-massage-relaxante-pour-homme.html;12.9;Un soin détente juste pour lui... Note de bois de Cèdre sur une base d'Argan, chouchoutez le mais attention les rôles peuvent s'inverser....;new;3516170012929;Florame;;http://www.lilibio.com/img/p/218-319-large.jpg;Corps>Massage;in stock;2;:::5.9;;;y;Florame;;0;;n;;;;;;
397-449; huile de massage yogi [florame] volume - 150 ml;http://www.lilibio.com/massage/397-huile-de-massage-yogi.html;16.9;Détendez votre corps et votre esprit. Un coktail d'huiles essentielles dynamisantes de lemongrass et palmarosa et des huiles pour la concentration interne comme le santal et l'encens.;new;3516170013391;Florame;;http://www.lilibio.com/img/p/397-517-large.jpg;Corps>Massage;in stock;3;:::5.9;;;y;Florame;;0;;n;;;;;;
398-450; huile de massage apaisante [florame] volume - 150 ml;http://www.lilibio.com/massage/398-huile-de-massage-apaisante.html;16.9;Lâchez-prise...enfin. Un subtil mélange d'huile d'orange douce, petit grain et camomille.;new;3516170015302;Florame;;http://www.lilibio.com/img/p/398-518-large.jpg;Corps>Massage;in stock;2;:::5.9;;;y;Florame;;0;;n;;;;;;
497-539; huile de massage au calendula [weleda] volume - 100 ml;http://www.lilibio.com/massage/497-huile-de-massage-au-calendula.html;11.2;L'huile de massage au calendula de Weleda protège et apaise les peaux sensibles et fragiles.;new;3596204270280;Weleda;;http://www.lilibio.com/img/p/497-622-large.jpg;Corps>Massage;in stock;4;:::5.9;;;y;Weleda;;0;;n;;;;;;
501-543; huile de massage à l'arnica [weleda] volume - 50 ml;http://www.lilibio.com/massage/501-huile-de-massage-a-l-arnica.html;7.6;L'huile de massage à l'Arnica de Weleda est formulée pour faciliter  la préparation et la récupération musculaire. Des huiles de Lavande et de Romarin qui luttent contre les courbatures.;new;3596206227794;Weleda;;http://www.lilibio.com/img/p/501-626-large.jpg;Corps>Massage;in stock;3;:::5.9;;;y;Weleda;;0;;n;;;;;;
501-544; huile de massage à l'arnica [weleda] volume - 100 ml;http://www.lilibio.com/massage/501-huile-de-massage-a-l-arnica.html;11.2;L'huile de massage à l'Arnica de Weleda est formulée pour faciliter  la préparation et la récupération musculaire. Des huiles de Lavande et de Romarin qui luttent contre les courbatures.;new;3596206226346;Weleda;;http://www.lilibio.com/img/p/501-627-large.jpg;Corps>Massage;in stock;3;:::5.9;;;y;Weleda;;0;;n;;;;;;
598-636; huile végétale de macadamia [melvita] volume - 200 ml;http://www.lilibio.com/massage/598-huile-vegetale-de-macadamia.html;20.9; Cette huile non grasse adoucissante est adaptée en soin hydratant pour les peaux normales à mixtes. Elle est aussi très appréciée en massage ou bien en mélange aromatique avec des huiles essentielles.;new;3284410015893;Melvita;;http://www.lilibio.com/img/p/598-736-large.jpg;Corps>Massage;in stock;1;:::5.9;;;y;Melvita;;0;;n;;;;;;
644-686; artro gel   [phytonature] volume - 100 ml;http://www.lilibio.com/massage/644-artro-gel.html;12.9;Une autre façon de soutenir son bien être Articulaire.;new;7001375002944;Phytonature;;http://www.lilibio.com/img/p/644-786-large.jpg;Corps>Massage;in stock;2;:::5.9;;;y;Phytonature;;0.1;;n;;;;;;
210; infusion bio aide minceur   [natessance];http://www.lilibio.com/infusions-et-thes/210-infusion-bio-aide-minceur.html;4.4;Reine des près, frêne, réglisse.;new;3517360006001;Natessance;;http://www.lilibio.com/img/p/210-789-large.jpg;Phytothérapie>Infusions et Thés;in stock;8;:::5.9;;;y;Natessance;;0;;n;;;;;;Santé et beauté
513-557; tisane allaitement [weleda] poids - 40g;http://www.lilibio.com/infusions-et-thes/513-tisane-allaitement.html;5.9;Les tisanes d'allaitement de Weleda sont riche en fenugrec, anis carvi et fenouil qui favorisent l'allaitement.;new;3596204791211;Weleda;;http://www.lilibio.com/img/p/513-640-large.jpg;Phytothérapie>Infusions et Thés;in stock;2;:::5.9;;;y;Weleda;;0;;n;;;;;;
646; thé vert doux équitable   [natessance];http://www.lilibio.com/infusions-et-thes/646-the-vert-doux-equitable.html;3.9;Pour le maintient d'une silhouette harmonieuse.;new;3517360020120;Natessance;;http://www.lilibio.com/img/p/646-788-large.jpg;Phytothérapie>Infusions et Thés;in stock;7;:::5.9;;;y;Natessance;;0;;n;;;;;;Santé et beauté
647; infusion jambes légères   [natessance];http://www.lilibio.com/infusions-et-thes/647-infusion-jambes-legeres.html;4.4;Elle facilite le bon fonctionnement de la circulation et favorise la microcirculation. ;new;3517360006056;Natessance;;http://www.lilibio.com/img/p/647-790-large.jpg;Phytothérapie>Infusions et Thés;in stock;15;:::5.9;;;y;Natessance;;0;;n;;;;;;Santé et beauté
648; infusion digestion ventre plat   [natessance];http://www.lilibio.com/infusions-et-thes/648-infusion-digestion-ventre-plat.html;4.4;Pour une digestion légère et efficace.;new;3517360006032;Natessance;;http://www.lilibio.com/img/p/648-791-large.jpg;Phytothérapie>Infusions et Thés;in stock;8;:::5.9;;;y;Natessance;;0;;n;;;;;;Santé et beauté
649; infusion thé minceur   [natessance];http://www.lilibio.com/infusions-et-thes/649-infusion-the-minceur.html;4.4;Facilite l'élimination et stimule la combustion des graisses.;new;3517360006025;Natessance;;http://www.lilibio.com/img/p/649-792-large.jpg;Phytothérapie>Infusions et Thés;in stock;12;:::5.9;;;y;Natessance;;0;;n;;;;;;Santé et beauté
650; infusion tilleul oranger   [natessance];http://www.lilibio.com/infusions-et-thes/650-infusion-tilleul-oranger.html;3.9;Pour délasser, favoriser la détente et un  retrouver un sommeil serein.;new;3517360020045;Natessance;;http://www.lilibio.com/img/p/650-793-large.jpg;Phytothérapie>Infusions et Thés;in stock;7;:::5.9;;;y;Natessance;;0;;n;;;;;;Santé et beauté
651; infision thym tonique   [natessance];http://www.lilibio.com/infusions-et-thes/651-infision-thym-tonique.html;3.9;Pour renforcer l'organisme.;new;3517360020113;Natessance;;http://www.lilibio.com/img/p/651-794-large.jpg;Phytothérapie>Infusions et Thés;in stock;7;:::5.9;;;y;Natessance;;0;;n;;;;;;Santé et beauté
652; infusion élimination rétention d'eau   [natessance];http://www.lilibio.com/infusions-et-thes/652-infusion-elimination-retention-d-eau.html;4.4;Pour purifier et faciliter l’élimination de ses toxines. ;new;3517360020106;Natessance;;http://www.lilibio.com/img/p/652-795-large.jpg;Phytothérapie>Infusions et Thés;in stock;8;:::5.9;;;y;Natessance;;0;;n;;;;;;Santé et beauté
653; infusion détente relaxation   [natessance];http://www.lilibio.com/infusions-et-thes/653-infusion-detente-relaxation.html;4.4;Pour calmer l’organisme, rééquilibrer les tensions et favoriser l’équilibre général. ;new;3517360020137;Natessance;;http://www.lilibio.com/img/p/653-796-large.jpg;Phytothérapie>Infusions et Thés;in stock;6;:::5.9;;;y;Natessance;;0;;n;;;;;;Santé et beauté
654; infusion bien-être articulaire   [natessance];http://www.lilibio.com/infusions-et-thes/654-infusion-bien-etre-articulaire.html;4.4;Pour lutter contre l’inconfort articulaire.;new;3517360020090;Natessance;;http://www.lilibio.com/img/p/654-797-large.jpg;Phytothérapie>Infusions et Thés;in stock;4;:::5.9;;;y;Natessance;;0;;n;;;;;;Santé et beauté
655; infusion draineur   [natessance];http://www.lilibio.com/infusions-et-thes/655-infusion-draineur.html;4.4;Pour favoriser les fonctions d'élimination.;new;3517360006063;Natessance;;http://www.lilibio.com/img/p/655-799-large.jpg;Phytothérapie>Infusions et Thés;in stock;4;:::5.9;;;y;Natessance;;0;;n;;;;;;Santé et beauté
656; infusion maté vert du brésil   [natessance];http://www.lilibio.com/infusions-et-thes/656-infusion-mate-vert-du-bresil.html;3.9;Reconnue pour ses vertus toniques et stimulantes.;new;3478820302197;Natessance;;http://www.lilibio.com/img/p/656-800-large.jpg;Phytothérapie>Infusions et Thés;in stock;4;:::5.9;;;y;Natessance;;0;;n;;;;;;Santé et beauté
685; infusion confort à la cranberry   [biosystem];http://www.lilibio.com/infusions-et-thes/685-infusion-confort-a-la-cranberry.html;4.4;Aide à éliminer eau et toxines en excès.;new;3456300009996;Biosystem;;http://www.lilibio.com/img/p/685-831-large.jpg;Phytothérapie>Infusions et Thés;in stock;7;:::5.9;;;y;Biosystem;;0;;n;;;;;;Santé et beauté
686; infusion sommeil détente   [biosystem];http://www.lilibio.com/infusions-et-thes/686-infusion-sommeil-detente.html;4.4;Idéal pour bien se relaxer.;new;3456300011029;Biosystem;;http://www.lilibio.com/img/p/686-832-large.jpg;Phytothérapie>Infusions et Thés;in stock;8;:::5.9;;;y;Biosystem;;0;;n;;;;;;Santé et beauté
21-55; l'instant précieux fluide vitalité créative [les douces angevines];http://www.lilibio.com/huile-seche/21-l-instant-precieux.html;31.8;Dynamisme, toutes familles de peaux.Ce  fluide huileux apporte vitalité et créativité aux personnes qui doivent entreprendre un nouveau départ. Les huiles de  macadamia, carthame et sésame se mêlent aux essences de romarin,lavande et cintron, pour vous apporter une bouffée d'énergie positive.;new;3555960000371;Les douces angevines;;http://www.lilibio.com/img/p/21-61-large.jpg;Corps>Huile ;in stock;2;:::5.9;;;y;Les douces angevines;;0;;n;;;;;;
22-56; l'idéale fluide sérénité et intuition [les douces angevines] volu;http://www.lilibio.com/huile-seche/22-l-ideale.html;26.8;Ce fluide huileux apporte sérénité aux peaux fragiles à tendance sèche, mais surtout aux personnes nerveuses et trop dynamiques. Les huiles de macadamia, carthame et abricot se mêlent aux essences de lavandin,basilic et myrte, pour aider à se recentrer sur soi même.;new;3555960000357;Les douces angevines;;http://www.lilibio.com/img/p/22-62-large.jpg;Corps>Huile ;in stock;1;:::5.9;;;y;Les douces angevines;;0;;n;;;;;;
23-57; l'amour aux 3 oranges fluide anti-stress  [les douces angevines] volu;http://www.lilibio.com/huile-seche/23-l-amour-aux-3-oranges.html;26.8;Anti-stress, peaux à tendance sèche.Ce  fluide huileux apporte détente cérébrale et physique aux personnes nerveuses et anxieuses. Les huiles de  macadamia, sésame et tournesol se mêlent aux essences de pamplemousse, orange, mandarine et néroli, pour vous apaiser et vous plonger dans un délice de douceur. ;new;3555960000302;Les douces angevines;;http://www.lilibio.com/img/p/23-64-large.jpg;Corps>Huile ;in stock;1;:::5.9;;;y;Les douces angevines;;0;;n;;;;;;
24-58; le coeur de baobab fluide force et séduction  [les douces angevines];http://www.lilibio.com/huile-seche/24-le-coeur-de-baobab.html;31.8;Force, toutes familles de peaux.Ce  fluide huileux apporte force et intuition à tous types de peau,  mais surtout aux personnes fatiguées. Les huiles de noisette et tournesol se mêlent aux essences de muscade, cannelle, girofle, gingembre et vanille, pour vous remplir d'énergie. ;new;3555960000319;Les douces angevines;;http://www.lilibio.com/img/p/24-65-large.jpg;Corps>Huile ;in stock;2;:::5.9;;;y;Les douces angevines;;0;;n;;;;;;
182-237; huile pailletée lumière d'orient lift'argan [natessance] volume - 5;http://www.lilibio.com/huile-seche/182-huile-paillete-limiere-d-orient-lift-argan.html;14.9;L'huile pailletée Désir d'Orient Lift'Argan est reflectrice de lumière, elle vous procure un hâle léger. Elle nourrit votre peau durablement et prolonge le bronzage;new;3517360052787;Natessance;;http://www.lilibio.com/img/p/182-281-large.jpg;Corps>Huile ;in stock;3;:::5.9;;;y;Natessance;;0;;n;;;;;;
190-244; huile sèche corps envoûtante lift'argan désir d'orient [natessance;http://www.lilibio.com/huile-seche/190-huile-seche-envoutante-pour-le-corps-desir-d-orient.html;18.9;L'huile sèche corps Envoûtante Lift'Argan nourrit votre peau intensément et vous enivre avec ses notes précieuses de Figue de Barbarie.;new;3517360000139;Natessance;;http://www.lilibio.com/img/p/190-290-large.jpg;Corps>Huile ;in stock;5;:::5.9;;;y;Natessance;;0;;n;;;;;;
484-526; huile harmonisante à la rose musquée [weleda] volume - 100 ml;http://www.lilibio.com/huile-seche/484-huile-harmonisante-a-la-rose-musquee.html;14.7;L'huile    harmonisante à la rose musquée de Weleda soutient la régénération    cutanée, hydrate, apporte douceur et confort à votre peau. ;new;3596207206835;Weleda;;http://www.lilibio.com/img/p/484-609-large.jpg;Corps>Huile ;in stock;4;:::5.9;;;y;Weleda;;0;;n;;;;;;
487-529; huile dynamisante à l'argousier [weleda] volume - 100 ml;http://www.lilibio.com/huile-seche/487-huile-dynamisante-a-l-argousier.html;14.7;L'huile dynamisante à l'argousier de Weleda régénère et lisse la peau, elle améliore l'élasticité de la peau et prévient le déssèchement après une exposition au soleil.;new;3596207684145;Weleda;;http://www.lilibio.com/img/p/487-612-large.jpg;Corps>Huile ;in stock;4;:::5.9;;;y;Weleda;;0;;n;;;;;;
489-531; huile vivifiante au citrus [weleda] volume - 100 ml;http://www.lilibio.com/huile-seche/489-huile-vivifiante-au-citrus.html;11.6;L'huile vivifiante au citrus de Weleda hydrate et nourrit votre peau tout en la parfumant de notes fraîches et toniques.;new;3596206694992;Weleda;;http://www.lilibio.com/img/p/489-614-large.jpg;Corps>Huile ;in stock;2;:::5.9;;;y;Weleda;;0;;n;;;;;;
495-537; huile régénératrice à la grenade [weleda] volume - 100 ml;http://www.lilibio.com/huile-seche/495-huile-regeneratrice-a-la-grenade.html;21.9;L'Huile régénératrice à la Grenade Weleda prévient le dessèchement de  la peau et préserve son élasticité. Jour après jour, l’épiderme est  plus lisse, plus ferme, plus satiné.;new;3596204200003;Weleda;;http://www.lilibio.com/img/p/495-620-large.jpg;Corps>Huile ;in stock;1;:::5.9;;;y;Weleda;;0;;n;;;;;;
