id;title;link;price;description;condition;ean;brand;mpn;image_link;product_type;availability;quantity;shipping;TVA;feature;online_only;manufacturer;expiration_date;shipping_weight;genre;featured_product;color;size;year;author;edition;google_product_category
324-386; composition freshtonic [florame] volume - 10 ml;http://www.lilibio.com/composition-a-diffuser/324-composition-freshtonic.html;6.9;Cette composition vous apportera du pétillant et la fraîcheur des agrumes dans vos pièces à vivre...;new;3516170000117;Florame;;http://www.lilibio.com/img/p/324-445-large.jpg;Aromathérapie>Composition d'huile essentielle à diffuser;in stock;3;:::5.9;;;y;Florame;;0;;n;;;;;;
325-387; composition orientale [florame] volume - 10 ml;http://www.lilibio.com/composition-a-diffuser/325-composition-orientale.html;6.9;Un air d'Orient rentre chez vous... Laissez vous seduire par les notes épicées et boisées du complex de diffusion Oriental.;new;3516170000193;Florame;;http://www.lilibio.com/img/p/325-446-large.jpg;Aromathérapie>Composition d'huile essentielle à diffuser;in stock;6;:::5.9;;;y;Florame;;0;;n;;;;;;
326-388; composition provence [florame] volume - 10 ml;http://www.lilibio.com/composition-a-diffuser/326-composition-provence.html;6.9;Des souvenirs de thym et de guarrigue vous envahissent...Decouvrez la composition du sud, senteur Provence.;new;3516170000230;Florame;;http://www.lilibio.com/img/p/326-447-large.jpg;Aromathérapie>Composition d'huile essentielle à diffuser;in stock;2;:::5.9;;;y;Florame;;0;;n;;;;;;
327-389; composition relax [florame] volume - 10 ml;http://www.lilibio.com/composition-a-diffuser/327-composition-relax.html;6.9;Detendez-vous et laissez les bienfaits des huiles essentielles agir sur vous....Diffusez ce complexe et détendez vous à la lumière d'une bougie....;new;3516170000254;Florame;;http://www.lilibio.com/img/p/327-448-large.jpg;Aromathérapie>Composition d'huile essentielle à diffuser;in stock;8;:::5.9;;;y;Florame;;0;;n;;;;;;
328-390; composition respiratoire [florame] volume - 10 ml;http://www.lilibio.com/composition-a-diffuser/328-composition-respiratoire.html;6.9;Protegez-vous avec un complexe basé sur les plus puissantes huiles anti-infectieuses et anti-virale. Diffusez le tout et vous êtes guéris.;new;3516170000278;Florame;;http://www.lilibio.com/img/p/328-449-large.jpg;Aromathérapie>Composition d'huile essentielle à diffuser;in stock;5;:::5.9;;;y;Florame;;0;;n;;;;;;
329-391; composition sensual [florame] volume - 10 ml;http://www.lilibio.com/composition-a-diffuser/329-composition-sensual.html;6.9;La senteur douce et suave de Sensual, vous enivre. Complexe de diffusion entre amoureux ou tout simplement pour vous détendre.;new;3516170001824;Florame;;http://www.lilibio.com/img/p/329-450-large.jpg;Aromathérapie>Composition d'huile essentielle à diffuser;in stock;7;:::5.9;;;y;Florame;;0;;n;;;;;;
330-392; composition yogi [florame] volume - 10 ml;http://www.lilibio.com/composition-a-diffuser/330-composition-yogi.html;6.9;Laissez vous aller à la détente du corps et de l'ésprit. Redevenez ZEN avec ce complexe de diffusion Florame.;new;3516170000353;Florame;;http://www.lilibio.com/img/p/330-451-large.jpg;Aromathérapie>Composition d'huile essentielle à diffuser;in stock;2;:::5.9;;;y;Florame;;0;;n;;;;;;
331-393; composition cannelle orange   [florame] volume - 10 ml;http://www.lilibio.com/composition-a-diffuser/331-composition-cannelle-orange.html;6.9;Souvenir de Noël... redecouvrez l'odeur des biscuits à la cannelle parsemés d'écorces d'orange;new;3516170000926;Florame;;http://www.lilibio.com/img/p/331-452-large.jpg;Aromathérapie>Composition d'huile essentielle à diffuser;in stock;6;:::5.9;;;y;Florame;;0;;n;;;;;;
332-394; composition anti-insectes   [florame] volume - 10 ml;http://www.lilibio.com/composition-a-diffuser/332-composition-anti-insectes.html;6.9;Oubliez les piqûres d'insectes et partez en vacances l'esprit libre! Ce mélange se diffuse partout aussi souvent que nécessaire pour protéger petits et grands.;new;3516170000018;Florame;;http://www.lilibio.com/img/p/332-453-large.jpg;Aromathérapie>Composition d'huile essentielle à diffuser;in stock;2;:::5.9;;;y;Florame;;0;;n;;;;;;
873-951; composition menthe-citron [florame] volume - 10 ml;http://www.lilibio.com/composition-a-diffuser/873-menthe-citron.html;7.5;Odeur tonique et fraîche. Dynamisez et purifiez votre maison en diffusant ce mélange aromatique avec votre diffuseur d'huiles essentielles.;new;3516170002180;Florame;;http://www.lilibio.com/img/p/873-1151-large.jpg;Aromathérapie>Composition d'huile essentielle à diffuser;in stock;6;:::5.9;;;y;Florame;;0;;n;;;;;;
338-397; nettoyant diffuseur [florame] volume - 50 ml;http://www.lilibio.com/diffuseur/338-nettoyant-diffuseur.html;5.9;Indispensable pour que votre diffuseur Florame retrouve sa jeunesse ! De l'alcool bio et de la lavande pour dissoudre les résidus d'huile essentielle.;new;3516170001671;Florame;;http://www.lilibio.com/img/p/338-457-large.jpg;Aromathérapie>Diffuseur d'huile essentielle;in stock;2;:::5.9;;;y;Florame;;0;;n;;;;;;
402;diffuseur électrique foncé+he gourmandise de noël offerte [florame];http://www.lilibio.com/diffuseur/402-diffuseur-electrique-harmonie-foncehe-gourmandise-de-noel-offerte.html;54.9;Laissez-vous guider par les huiles essentielles. Ce diffuseur électrique en verre soufflé diffusera toutes les senteurs que vous souhaitez, au gré de vos envies....A PRIX CANON!OFFERT: une composition gourmandise de Noël 10 mL.;new;3516170010628;Florame;;http://www.lilibio.com/img/p/402-522-large.jpg;Aromathérapie>Diffuseur d'huile essentielle;in stock;2;:::5.9;;;y;Florame;;0;;n;;;;;;Santé et beauté
403; diffuseur électrique clair+he gourmandise de noël offerte [florame];http://www.lilibio.com/diffuseur/403-diffuseur-electrique-harmonie-clairhe-gourmandise-de-noel-offerte.html;54.9;Laissez-vous guider par les huiles essentielles. Ce diffuseur électrique en verre soufflé diffusera toutes les senteurs que vous souhaitez, au gré de vos envies....A PRIX CANON!OFFERT: une composition gourmandise de Noël 10 mL.;new;3516170010611;Florame;;http://www.lilibio.com/img/p/403-523-large.jpg;Aromathérapie>Diffuseur d'huile essentielle;in stock;1;:::5.9;;;y;Florame;;0;;n;;;;;;Santé et beauté
844; godet et bâtonnet de bois [florame];http://www.lilibio.com/diffuseur/844-godet-et-batonnet-de-bois.html;3.9;Le diffuseur nomade et écologique. Pratique, il suffit de déposer son flacon d'huile essentielle dans le godet et par capillarité l'huile essentielle remonte le long du bâtonnet et s'évapore peu à peu.;new;3;Florame;;http://www.lilibio.com/img/p/844-1092-large.jpg;Aromathérapie>Diffuseur d'huile essentielle;in stock;1;:::5.9;;;y;Florame;;0;;n;;;;;;Santé et beauté
845; recharge bâtonnets x3 [florame];http://www.lilibio.com/diffuseur/845-recharge-batonnets-x3.html;3.9;Le diffuseur nomade et écologique à déposer partout et qui diffuse selon vos envies.;new;3516170002159;Florame;;http://www.lilibio.com/img/p/845-1093-large.jpg;Aromathérapie>Diffuseur d'huile essentielle;in stock;9;:::5.9;;;y;Florame;;0;;n;;;;;;Santé et beauté
929;confort urinaire  [phytoceutic];http://www.lilibio.com/confort-urinaire/929-confort-urinaire-phytoceutic-.html;15.9;Le Cranberry et  l'Hibiscus associés à l'acérola et à l'ortie sont idéales pour  prévenir les infections urinaires, pour irriguer les reins, la vessie en cas d’inflammation et pour prévenir et traiter les calculs rénaux.;new;3492270070086;Phytoceutic;;http://www.lilibio.com/img/p/929-1198-large.jpg;Phytothérapie>Confort urinaire;in stock;7;:::5.9;;;y;Phytoceutic;;0;;n;;;;;;Santé et beauté
280-338; bougie parfumée caprice d'épices   [florame] poids - 120g;http://www.lilibio.com/bougie/280-bougie-parfumee-caprice-d-epices.html;12.7;Parfumez  votre intérieur tout naturellement. Cette bougie est exclusivement composée d'huiles  essentielles BIO. Cire et mèche 100% d'origine végétale.;new;3516170016170;Florame;;http://www.lilibio.com/img/p/280-383-large.jpg;Maison>Bougie;in stock;2;:::5.9;;;y;Florame;;0;;n;;;;;;
281-339; bougie parfumée lavande gourmande   [florame] poids - 120g;http://www.lilibio.com/bougie/281-bougie-parfumee-lavande-gourmande.html;12.7;Parfumez   votre intérieur tout naturellement. Cette bougie est exclusivement  composée d'huiles  essentielles BIO. Cire et mèche 100% d'origine  végétale.;new;3516170016231;Florame;;http://www.lilibio.com/img/p/281-384-large.jpg;Maison>Bougie;in stock;2;:::5.9;;;y;Florame;;0;;n;;;;;;
283-341; bougie parfumée verveine aérienne   [florame] poids - 120g;http://www.lilibio.com/bougie/283-bougie-parfumee-verveine-aerienne.html;12.7;Parfumez   votre intérieur tout naturellement. Cette bougie est exclusivement  composée d'huiles  essentielles BIO. Cire et mèche 100% d'origine  végétale.;new;3516170016187;Florame;;http://www.lilibio.com/img/p/283-386-large.jpg;Maison>Bougie;in stock;3;:::5.9;;;y;Florame;;0;;n;;;;;;
290-348; parfum d'intérieur divine mandarine [florame] volume - 100 ml;http://www.lilibio.com/parfum-interieur/290-parfum-d-interieur-divine-mandarine.html;12.9;Respirez mieux, respirez bio. Senteur gourmande et fraîche d'un panier de mandarine.;new;3516170016286;Florame;;http://www.lilibio.com/img/p/290-394-large.jpg;Maison>Parfum intérieur;in stock;4;:::5.9;;;y;Florame;;0;;n;;;;;;
291-349; parfum d'intérieur caprice d'épices [florame] volume - 100 ml;http://www.lilibio.com/parfum-interieur/291-parfum-d-interieur-caprice-d-epices.html;12.9;Respirez mieux, respirez bio. Senteur cannelle orange du pain d'épices.;new;3516170016262;Florame;;http://www.lilibio.com/img/p/291-395-large.jpg;Maison>Parfum intérieur;in stock;3;:::5.9;;;y;Florame;;0;;n;;;;;;
292-350; parfum d'intérieur lavande gourmande [florame] volume - 100 ml;http://www.lilibio.com/parfum-interieur/292-parfum-d-interieur-lavande-gourmande.html;12.9;Respirez mieux, respirez bio. Senteur fleurie et délicate d'un bouquet de lavande.;new;3516170016330;Florame;;http://www.lilibio.com/img/p/292-399-large.jpg;Maison>Parfum intérieur;in stock;1;:::5.9;;;y;Florame;;0;;n;;;;;;
293-351; parfum d'intérieur pureté raffinée [florame] volume - 100 ml;http://www.lilibio.com/parfum-interieur/293-parfum-d-interieur-verveine-aerienne.html;12.9;Respirez mieux, respirez bio. Senteur fraîche et chlorophyllée et poivrée. ;new;3516170016316;Florame;;http://www.lilibio.com/img/p/293-397-large.jpg;Maison>Parfum intérieur;in stock;2;:::5.9;;;y;Florame;;0;;n;;;;;;
294-352; parfum d'intérieur verveine aérienne [florame] volume - 100 ml;http://www.lilibio.com/parfum-interieur/294-parfum-d-interieur-verv.html;12.9;Respirez mieux, respirez bio. Senteur citronnée de la verveine d'autant.;new;3516170016279;Florame;;http://www.lilibio.com/img/p/294-398-large.jpg;Maison>Parfum intérieur;in stock;2;:::5.9;;;y;Florame;;0;;n;;;;;;
909-996;parfum d'intérieur sérénité sacrée [florame] volume - 100 ml;http://www.lilibio.com/parfum-interieur/909-parfum-d-interieur-serenite-sacree-florame-.html;12.9;Respirez mieux, respirez bio. Senteur poudrée et chaude.;new;3516170016347;Florame;;http://www.lilibio.com/img/p/909-1174-large.jpg;Maison>Parfum intérieur;in stock;3;:::5.9;;;y;Florame;;0;;n;;;;;;
964-1046;parfum d'interieur instant relaxant [florame] volume - 100 ml;http://www.lilibio.com/parfum-interieur/964-parfum-d-interieur-instant-relaxant-florame-.html;12.9;Respirez mieux, respirez bio. Senteur douce et chaudes.;new;3516170016330;Florame;;http://www.lilibio.com/img/p/964-1240-large.jpg;Maison>Parfum intérieur;in stock;1;:::5.9;;;y;Florame;;0;;n;;;;;;
284-342; bouquet parfumé lavande gourmande avec 8 tiges de rotin  [florame] v;http://www.lilibio.com/batonnet-parfume/284-bouquet-parfume-lavande-gourmande.html;17.91;Parfumez tout naturellement. Ses bâtonnets en rotin diffusent une odeur douce en continue dans toute la maison. Agréable à voir et surtout à sentir.;new;3516170016552;Florame;;http://www.lilibio.com/img/p/284-387-large.jpg;Maison>Batonnet parfumé;in stock;1;:::5.9;;;y;Florame;;0;;y;;;;;;
58-91; soin hydratant homme gueule d'ange   [cattier] volume - 50 ml;http://www.lilibio.com/visage/58-gueluel-d-ange.html;15.9;Un soin protecteur qui apaise et hydrate l'épiderme. Ce soin riche en Aloé vera protège votre peau et le cacao épicé donne en effet dynamisant à votre teint.;new;3283950912013;Cattier;;http://www.lilibio.com/img/p/58-121-large.jpg;Homme>Soin hydratant visage;in stock;2;:::5.9;;;y;Cattier;;0;;n;;;;;;
171-224; soin visage homme 3 en 1 lift argan [natessance] volume - 50 ml;http://www.lilibio.com/visage/171-soin-visage-3-en-1-lift-argan.html;16.9;Le soin visage Homme Lift'Argan est un soin complet anti-âge, hydratant et apaisant après rasage. de l'huile d'Argan pour prévenir les signe du temps, du Beurre de Karité pour nourrir la peau et du Marrube blanc pour aider à la cicatrisation.;new;3517360032796;Natessance;;http://www.lilibio.com/img/p/171-270-large.jpg;Homme>Soin hydratant visage;in stock;4;:::5.9;;;y;Natessance;;0;;n;;;;;;
217-273; crème anti-âge homme [florame] volume - 30 ml;http://www.lilibio.com/visage/217-creme-anti-age-bio.html;15.3;Crème hydratante et non grasse. Un complexe de Cèdre et d'Argan pour hydrater et protéger votre peau. Une action anti-brillance et une peau plus lisse et plus jeune.;new;3516170012851;Florame;;http://www.lilibio.com/img/p/217-318-large.jpg;Homme>Soin hydratant visage;in stock;3;:::5.9;;;y;Florame;;0;;n;;;;;;
519-563; crème hydratante homme [weleda] volume - 30 ml;http://www.lilibio.com/visage/519-creme-hydratante-homme.html;12.1;Ce soin à la texture légère et fluide préserve du dessèchement cutané et apporte souplesse et confort à la peau.;new;3596204268898;Weleda;;http://www.lilibio.com/img/p/519-646-large.jpg;Homme>Soin hydratant visage;in stock;6;:::5.9;;;y;Weleda;;0;;n;;;;;;
549-590; baume après rasage homme [melvita] volume - 50 ml;http://www.lilibio.com/visage/549-baume-apres-rasage.html;16.5;Ce baume à la texture non grasse apaise le feu du rasoir, cicatrice les micro-coupures et nourrit votre peau. Des actifs végétaux apaisants comme l'aloé vera et des actifs réparateurs comme le beurre de karité ou l'huile de jojoba.;new;3284410014360;Melvita;;http://www.lilibio.com/img/p/549-679-large.jpg;Homme>Soin hydratant visage;in stock;1;:::5.9;;;y;Melvita;;0;;n;;;;;;
550-591; fluide anti-âge homme   [melvita] volume - 50 ml;http://www.lilibio.com/visage/550-fluide-anti-age-homme.html;19.9;Soin réparateur, lissant, défatiguant et anti-âge. Il protège et nourrit votre peau toute la journée. Des actifs d'origine végétale pour vivifier, hydrater votre peau et surout l'aider à combattre contre les méfaits du temps.;new;3284410014407;Melvita;;http://www.lilibio.com/img/p/550-680-large.jpg;Homme>Soin hydratant visage;in stock;1;:::5.9;;;y;Melvita;;0;;n;;;;;;
55-88;mousse à raser fine lame   [cattier] volume - 150 ml;http://www.lilibio.com/rasage/55-fine-lame.html;9.9;Une mousse douce et aérienne pour un rasage optimal. De l'aloé vera pour cictriser et protéger.;new;3283950912020;Cattier;;http://www.lilibio.com/img/p/55-118-large.jpg;Homme>Soin du rasage;in stock;6;:::5.9;;;y;Cattier;;0;;n;;;;;;
56-89;baume après rasage pare feu   [cattier] volume - 75 ml;http://www.lilibio.com/rasage/56-pare-feu.html;11.4;Un baume frais et léger pour calmer le feu du rasoir et réparer l’épiderme.;new;3283950912037;Cattier;;http://www.lilibio.com/img/p/56-1104-large.jpg;Homme>Soin du rasage;in stock;6;:::5.9;;;y;Cattier;;0;;n;;;;;;
131-182; baume après rasage, ralentisseur de repousse  [allo'nature] volume -;http://www.lilibio.com/rasage/131-baume-apres-rasage-ralentisseur-de-repousse.html;14.9;Apaise le feu du rasoir et ralentit la repousse du poil. Fomulé à partir d'huile d'Olive et d'huile de baies de Laurier pour hydrater nourrir et purifier.;new;3760125130194;Allo'nature;;http://www.lilibio.com/img/p/131-201-large.jpg;Homme>Soin du rasage;in stock;2;:::5.9;;;y;Allo'nature;;0;;n;;;;;;
215-271; baume après rasage homme  [florame] volume - 75 ml;http://www.lilibio.com/rasage/215-baume-apres-rasage.html;13.4;Ce soin cicatrisant non gras, s'adapte à toutes les peaux. Un complexe de Cèdre et d'Argan pour hydrater et protéger.;new;3516170012943;Florame;;http://www.lilibio.com/img/p/215-316-large.jpg;Homme>Soin du rasage;in stock;3;:::5.9;;;y;Florame;;0;;n;;;;;;
219-275; mousse de rasage homme [florame] volume - 150 ml;http://www.lilibio.com/rasage/219-mousse-de-rasage.html;11.9;Rafraichissante et protectrice. Un complexe de Cèdre et d'Argan pour hydrater et protéger. ;new;3516170012868;Florame;;http://www.lilibio.com/img/p/219-320-large.jpg;Homme>Soin du rasage;in stock;2;:::5.9;;;y;Florame;;0;;n;;;;;;
220-276; huile de rasage homme [florame] volume - 30 ml;http://www.lilibio.com/rasage/220-huile-de-rasage-.html;11.6;Pour une glisse et une protection parfaite. Cette huile au complexe Argan-Cèdre vous protège et vous nourrit.;new;3516170012905;Florame;;http://www.lilibio.com/img/p/220-321-large.jpg;Homme>Soin du rasage;in stock;3;:::5.9;;;y;Florame;;0;;n;;;;;;
516-560; crème à raser adoucissante homme [weleda] volume - 75 ml;http://www.lilibio.com/rasage/516-creme-a-raser-adoucissante.html;6.2;Avec sa mousse fine et onctueuse, il prépare le poil au passage de la lame. Recommandée en cas de rasage difficile et douloureux des peaux sensibles.;new;3596206289112;Weleda;;http://www.lilibio.com/img/p/516-643-large.jpg;Homme>Soin du rasage;in stock;7;:::5.9;;;y;Weleda;;0;;n;;;;;;
517-561; baume après rasage homme  [weleda] volume - 100 ml;http://www.lilibio.com/rasage/517-baume-apres-rasage.html;10.4;Protège et apaisel'épiderme agréssé par le rasage en apportant confort et douceur. De la Myrrhe pour son action anti-inflammatoire et de l'Aloé vera pour hydrater et rafraîchir les peaux sensibilisées.;new;3596207244240;Weleda;;http://www.lilibio.com/img/p/517-644-large.jpg;Homme>Soin du rasage;in stock;5;:::5.9;;;y;Weleda;;0;;n;;;;;;
518-562; lotion après rasage homme [weleda] volume - 100 ml;http://www.lilibio.com/rasage/518-lotion-apres-rasage.html;9.7;Lotion après-rasage composée d’eau d’Hamamélis et  d’extrait de Myrrhe pour une action astringente. Sa note fraîche est tonique reveil l'épiderme.;new;3596207201960;Weleda;;http://www.lilibio.com/img/p/518-645-large.jpg;Homme>Soin du rasage;in stock;8;:::5.9;;;y;Weleda;;0;;n;;;;;;
693; Éclat de beauté préparation solaire  [phytoceutic];http://www.lilibio.com/solaire/693-ecla.html;22.9;Le premier complément alimentaire préparateur de soleil, BIO. Adieu coups de soleil et bonjour peau dorée!;new;3492270005415;Phytoceutic;;http://www.lilibio.com/img/p/693-839-large.jpg;Phytothérapie>Solaire;in stock;6;:::5.9;;;y;Phytoceutic;;0;;n;;;;;;Santé et beauté
71-120; crème main à l'argile blanche   [cattier] volume - 75 ml;http://www.lilibio.com/main-et-pieds/71-creme-main-a-l-argile-blanche.html;6.5;Le soin quotidien idéal pour réparer les mains sèches et abîmées. Texture non grasse grâce à l'argile blanche.;new;3283950050142;Cattier;;http://www.lilibio.com/img/p/71-149-large.jpg;Corps>Mains;in stock;1;:::5.9;;;y;Cattier;;0;;n;;;;;;
181-243; soin des mains nourrissant anti-âge lift'argan [natessance] volume -;http://www.lilibio.com/main-et-pieds/181-soin-des-mains-nourrissant-anti-age-lift-argan.html;12.9;La crème main anti-âge Lift'Argan est un soin unique hydratant, nourrissant et qui atténue les effets du vieillissement.;new;3517360047141;Natessance;;http://www.lilibio.com/img/p/181-280-large.jpg;Corps>Mains;in stock;7;:::5.9;;;y;Natessance;;0;;n;;;;;;
213-269; soin main réparateur anti-tâches [natessance] volume - 50 ml;http://www.lilibio.com/main-et-pieds/213-soin-main-reparateur-anti-taches-bio.html;15.9;Le soin main réparateur Lift'Argan prévient et traite les tâches brunes avec son actif éclaircissant breveté Sépiwhite®.;new;3517360015072;Natessance;;http://www.lilibio.com/img/p/213-314-large.jpg;Corps>Mains;in stock;5;:::5.9;;;y;Natessance;;0;;n;;;;;;
243-298; crème mains velours dermastress  [florame] volume - 75 ml;http://www.lilibio.com/main-et-pieds/243-creme-mains-velours.html;13.9;Soin protecteur et nourrissant des mains et ongles.   Le   complexe dermastress riche en huiles essentielles et végétales,   protège nourrit et combat contre les agressions exterieures et les   signes de l'âge.;new;3516170017023;Florame;;http://www.lilibio.com/img/p/243-346-large.jpg;Corps>Mains;in stock;2;:::5.9;;;y;Florame;;0;;n;;;;;;
248-303; crème mains protectrice nutrition intense [florame] volume - 100 ml;http://www.lilibio.com/main-et-pieds/248-creme-mains-protectrice.html;14.9;Soin nourrissant au beurre de karité BIO. La gamme nutrition   intense régénère et protège avec son complexe de beurre de karité,   huiles essentielles de bois de rose, orange amère et ylang ylang.;new;3516170018433;Florame;;http://www.lilibio.com/img/p/248-351-large.jpg;Corps>Mains;in stock;2;:::5.9;;;y;Florame;;0;;n;;;;;;
272-330; baume de satin soin mains actives   [les douces angevines] volume - 3;http://www.lilibio.com/main-et-pieds/272-baume-de-satin.html;24.9;Fluide sublimateur mains et ongles. Répare efficacement les mains abîmées et écorchées, les ongles cassants et mous et estompe les tâches brunes. Les huiles de ricin, rose musquée du Chili et carotte nourrissent et ramolissent les cuticules.;new;3555960000180;Les douces angevines;;http://www.lilibio.com/img/p/272-375-large.jpg;Corps>Mains;in stock;3;:::5.9;;;y;Les douces angevines;;0;;n;;;;;;
488-530; crème main à l'argousier [weleda] volume - 50 ml;http://www.lilibio.com/main-et-pieds/488-creme-main-a-l-argousier.html;6.8;Ce soin à la texture non grasse, régénère et revitalise. S'utilise aussi souvent que nécessaire. Senteur frais et fruité.;new;3596207787587;Weleda;;http://www.lilibio.com/img/p/488-613-large.jpg;Corps>Mains;in stock;5;:::5.9;;;y;Weleda;;0;;n;;;;;;
491-533; crème main au citrus [weleda] volume - 50 ml;http://www.lilibio.com/main-et-pieds/491-creme-main-au-citrus.html;6.8;Ce soin à la texture riche répare et nourrit les mains abîmées. Elle restaure le film hydro-lipidique et supprime les sensations de tiraillements.;new;3596204459593;Weleda;;http://www.lilibio.com/img/p/491-616-large.jpg;Corps>Mains;in stock;5;:::5.9;;;y;Weleda;;0;;n;;;;;;
494-536; crème main à la grenade [weleda] volume - 50 ml;http://www.lilibio.com/main-et-pieds/494-creme-main-a-la-grenade.html;8.3;Ce véritable soin des mains, retarde les signes du vieillissement et prévient des tâches pigmentaires. Une texture non grasse qui pénètre rapidement. Senteur boisée et chaude des huiles essentielles de Grenade et de Santal.;new;3596204200034;Weleda;;http://www.lilibio.com/img/p/494-619-large.jpg;Corps>Mains;in stock;4;:::5.9;;;y;Weleda;;0;;n;;;;;;
635-677; crème main   [marilou bio] volume - 75 ml;http://www.lilibio.com/main-et-pieds/635-creme-main.html;3.9;Soin main pratique et économique. Formulée à partir de glycérine végétale, d'huile de jojoba et de protéine de blé.;new;3760143830533;Marilou bio;;http://www.lilibio.com/img/p/635-777-large.jpg;Corps>Mains;in stock;3;:::5.9;;;y;Marilou bio;;0;;n;;;;;;
696-713; crème mains adoucissante   [melvita] volume - 100 ml;http://www.lilibio.com/main-et-pieds/696-creme-mains-adoucissante.html;8.9; Adoucissante et ultra fondante. Ce soin allie l'action du calendula pour adoucir, le miel et le karité pour hydrater et protéger et l'huile de  ricin pour fortifier les ongles.;new;3284410014049;Melvita;;http://www.lilibio.com/img/p/696-842-large.jpg;Corps>Mains;in stock;2;:::5.9;;;y;Melvita;;0;;n;;;;;;
1008-1122;touche nacre [couleur caramel] couleur - 5-granit;http://www.lilibio.com/nacres/1008-touche-nacre-couleur-caramel-.html;12.2;Les touches de nacre Couleur Caramel sont Idéales pour illuminer le regard, créer des zones de lumière sur les lèvres ou un scintillement subtil sur le corps. Existe en 2 teintes.;new;3700306913055;Couleur caramel;;http://www.lilibio.com/img/p/1008-1349-large.jpg;Maquillage>Les yeux>Nacre;in stock;1;:::5.9;;;y;Couleur caramel;;0;;n;;;;;;
1008-1123;touche nacre [couleur caramel] couleur - 12-noir intense;http://www.lilibio.com/nacres/1008-touche-nacre-couleur-caramel-.html;12.2;Les touches de nacre Couleur Caramel sont Idéales pour illuminer le regard, créer des zones de lumière sur les lèvres ou un scintillement subtil sur le corps. Existe en 2 teintes.;new;3700306913123;Couleur caramel;;http://www.lilibio.com/img/p/1008-1350-large.jpg;Maquillage>Les yeux>Nacre;in stock;1;:::5.9;;;y;Couleur caramel;;0;;n;;;;;;
35-68; fée proprette fluide nettoyant  [les douces angevines] volume - 125 ;http://www.lilibio.com/le-change/35-fee-proprette.html;19.9;Fluide nettoyant apaisant pour bébés et jeunes enfants. Ce fluide huileux previent et traite les croûtes de lait avec l'action purifiante de la pensée sauvage. L'huile de carthame protège est adoucit la peau.;new;3555960000883;Les douces angevines;;http://www.lilibio.com/img/p/35-75-large.jpg;Bébé>Le change;in stock;3;:::5.9;;;y;Les douces angevines;;0;;n;;;;;;
36-69; fée luzette fluide bien-être bébés  [les douces angevines] volume;http://www.lilibio.com/le-change/36-fee-luzette.html;15.6;Huile de massage et de détente des touts petits. Adaptée dès la naissance ce soin de réconfort s'utlise pour initier bébé au sensation du toucher, adoucir les croutes de lait ou bien apaiser les seins pendant l'allaitement. Riche en calendula et en huile d'amande douce de Luzette.;new;3555960000500;Les douces angevines;;http://www.lilibio.com/img/p/36-76-large.jpg;Bébé>Le change;in stock;2;:::5.9;;;y;Les douces angevines;;0;;n;;;;;;
